{
  "$schema": "./schema.json",
  "ruleSet": "liquid-glass",
  "dataVersion": "2026.10.27",
  "sdk": "iOS 27 SDK (checked with Xcode 27.1, 27A9275, on the iOS 27.0 and iOS 26.4 simulators)",
  "rules": [
    {
      "id": "GLS001",
      "severity": "error",
      "title": "Liquid Glass opt-out that the iOS 27 SDK ignores",
      "summary": "UIDesignRequiresCompatibility is YES, so the app asks to keep the design of earlier SDKs. Apple: the system ignores this key when you build for iOS 27 or later. Built with Xcode 27, the app shows Liquid Glass on iOS 27 whatever the key says; on iOS 26 the same build still keeps the old design, so two looks ship at once.",
      "sources": [
        {
          "title": "Apple: UIDesignRequiresCompatibility",
          "url": "https://developer.apple.com/documentation/bundleresources/information-property-list/uidesignrequirescompatibility"
        },
        {
          "title": "Apple: Adopting Liquid Glass",
          "url": "https://developer.apple.com/documentation/technologyoverviews/adopting-liquid-glass"
        }
      ],
      "fixes": {
        "info-plist": {
          "title": "Remove the opt-out and review the screens with Liquid Glass",
          "steps": [
            "Delete the UIDesignRequiresCompatibility key from the Info.plist.",
            "Build with Xcode 27 and run the app on an iOS 27 simulator; the other findings in this report are the places to look at first.",
            "Keep the brand colour on tint (buttons, selected tab) rather than on bar backgrounds, so the system can draw the bars."
          ],
          "guide": "docs/guides/opt-out.md"
        },
        "build-setting": {
          "title": "Remove the build setting and review the screens with Liquid Glass",
          "steps": [
            "Delete INFOPLIST_KEY_UIDesignRequiresCompatibility from the target's build settings. Xcode 27.1 does not copy it into the Info.plist it generates, so it has no effect there in any case.",
            "Build with Xcode 27 and run the app on an iOS 27 simulator; the other findings in this report are the places to look at first."
          ],
          "guide": "docs/guides/opt-out.md"
        },
        "expo-config": {
          "title": "Remove the opt-out from the Expo config and rebuild the native project",
          "steps": [
            "Delete UIDesignRequiresCompatibility from ios.infoPlist in the Expo config.",
            "Run npx expo prebuild --clean -p ios (or let EAS Build do it) so the generated Info.plist no longer has it.",
            "Run the app on an iOS 27 simulator; the other findings in this report are the places to look at first."
          ],
          "guide": "docs/guides/react-native-expo.md"
        }
      }
    },
    {
      "id": "GLS002",
      "severity": "warning",
      "title": "Bar appearance with its own background",
      "summary": "A UINavigationBarAppearance, UITabBarAppearance or UIToolbarAppearance gets an opaque configuration or its own background colour, image, blur or shadow. Apple asks to reduce custom backgrounds in navigation elements: they can overlay or interfere with Liquid Glass and the scroll edge effect.",
      "sources": [
        {
          "title": "Apple: Adopting Liquid Glass (Visual refresh)",
          "url": "https://developer.apple.com/documentation/technologyoverviews/adopting-liquid-glass"
        },
        {
          "title": "Apple: configureWithOpaqueBackground()",
          "url": "https://developer.apple.com/documentation/uikit/uibarappearance/configurewithopaquebackground()"
        },
        {
          "title": "Apple: UIBarAppearance.backgroundEffect",
          "url": "https://developer.apple.com/documentation/uikit/uibarappearance/backgroundeffect"
        }
      ],
      "fixes": {
        "uikit": {
          "title": "Let the system draw the bar background",
          "steps": [
            "Remove configureWithOpaqueBackground() and the backgroundColor, backgroundImage, backgroundEffect and shadow settings of the appearance, or apply them only before iOS 26 with if #available(iOS 26.0, *).",
            "Move the brand colour to tintColor and the title text attributes.",
            "Check the bar over scrolling content: the scroll edge effect replaces the hairline and the opaque background."
          ],
          "guide": "docs/guides/native-ios.md"
        }
      }
    },
    {
      "id": "GLS003",
      "severity": "warning",
      "title": "Bar colour or translucency set the old way",
      "summary": "barTintColor, isTranslucent = false, a bar background image (setBackgroundImage with bar metrics) or a shadow image paints the bar itself. Like a custom appearance background, it covers the material the system draws for navigation elements.",
      "sources": [
        {
          "title": "Apple: Adopting Liquid Glass (Visual refresh)",
          "url": "https://developer.apple.com/documentation/technologyoverviews/adopting-liquid-glass"
        },
        {
          "title": "Apple: UINavigationBar.barTintColor",
          "url": "https://developer.apple.com/documentation/uikit/uinavigationbar/bartintcolor"
        },
        {
          "title": "Apple: UINavigationBar.isTranslucent",
          "url": "https://developer.apple.com/documentation/uikit/uinavigationbar/istranslucent"
        }
      ],
      "fixes": {
        "uikit": {
          "title": "Remove the bar colour and let the bar stay translucent",
          "steps": [
            "Remove barTintColor, isTranslucent = false and the bar background and shadow images, or apply them only before iOS 26 with if #available(iOS 26.0, *).",
            "Use tintColor for the brand colour of the bar's buttons."
          ],
          "guide": "docs/guides/native-ios.md"
        }
      }
    },
    {
      "id": "GLS004",
      "severity": "warning",
      "title": "SwiftUI bar background set by the app",
      "summary": "toolbarBackground or toolbarBackgroundVisibility sets the background of a navigation bar, tab bar or bottom bar. Apple asks to remove custom backgrounds from bars and let the system determine the background appearance.",
      "sources": [
        {
          "title": "Apple: Adopting Liquid Glass (Visual refresh)",
          "url": "https://developer.apple.com/documentation/technologyoverviews/adopting-liquid-glass"
        },
        {
          "title": "Apple: toolbarBackground(_:for:)",
          "url": "https://developer.apple.com/documentation/swiftui/view/toolbarbackground(_:for:)"
        },
        {
          "title": "Apple: toolbarBackgroundVisibility(_:for:)",
          "url": "https://developer.apple.com/documentation/swiftui/view/toolbarbackgroundvisibility(_:for:)"
        }
      ],
      "fixes": {
        "swiftui": {
          "title": "Remove the bar background modifiers",
          "steps": [
            "Remove toolbarBackground(_:for:) and toolbarBackgroundVisibility(_:for:), or apply them only before iOS 26.",
            "Keep the brand colour on tint(_:) and on the content, not on the bar."
          ],
          "guide": "docs/guides/native-ios.md"
        }
      }
    },
    {
      "id": "GLS005",
      "severity": "warning",
      "title": "Custom tab bar or bottom bar",
      "summary": "The app hides the system tab bar or draws its own (a UITabBar or UIToolbar subclass, a hidden tabBar, toolbar(.hidden, for: .tabBar)). A custom bar does not become Liquid Glass and, unless it is registered for it, content scrolling under it gets no scroll edge effect, so it looks different from every system bar around it.",
      "sources": [
        {
          "title": "Apple: Adopting Liquid Glass (Controls, Navigation)",
          "url": "https://developer.apple.com/documentation/technologyoverviews/adopting-liquid-glass"
        },
        {
          "title": "Apple: UIScrollEdgeElementContainerInteraction",
          "url": "https://developer.apple.com/documentation/uikit/uiscrolledgeelementcontainerinteraction"
        },
        {
          "title": "Apple: safeAreaBar(edge:alignment:spacing:content:)",
          "url": "https://developer.apple.com/documentation/swiftui/view/safeareabar(edge:alignment:spacing:content:)"
        }
      ],
      "fixes": {
        "uikit": {
          "title": "Use the system tab bar, or give the custom bar a scroll edge effect",
          "steps": [
            "Where the custom bar only restyles tabs, go back to UITabBarController's tab bar; tabBarMinimizeBehavior and UITab cover many reasons for custom bars.",
            "If the bar stays custom, add a UIScrollEdgeElementContainerInteraction to its container view and consider UIGlassEffect for its background."
          ],
          "guide": "docs/guides/native-ios.md"
        },
        "swiftui": {
          "title": "Use the system tab bar, or attach the custom bar with safeAreaBar",
          "steps": [
            "Where the custom bar only restyles tabs, use TabView with Tab and tabBarMinimizeBehavior(_:) instead.",
            "If the bar stays custom, attach it with safeAreaBar(edge:alignment:spacing:content:) so content under it gets the scroll edge effect, and consider glassEffect(_:in:) for its background."
          ],
          "guide": "docs/guides/native-ios.md"
        }
      }
    },
    {
      "id": "GLS006",
      "severity": "info",
      "title": "Blur layer without a Liquid Glass counterpart",
      "summary": "A UIVisualEffectView with a UIBlurEffect, in a file that does not use UIGlassEffect. If it backs a popover, a sheet or a floating control, Apple asks to remove such background views from popovers and to use the glass effect for custom controls; a plain content blur can stay.",
      "sources": [
        {
          "title": "Apple: Adopting Liquid Glass (Windows and modals)",
          "url": "https://developer.apple.com/documentation/technologyoverviews/adopting-liquid-glass"
        },
        {